[
  {
    "sql_key": "com.test.mapper.OrderMapper.findOrdersComplex",
    "execution_time_ms": 0,
    "rows_scanned": 0,
    "execution_plan": {
      "node_type": "UNKNOWN",
      "index_used": null,
      "cost": null
    },
    "result_hash": "28031267db42",
    "rows_returned": 0,
    "database_platform": "unknown",
    "sample_params": {},
    "actual_execution_time_ms": null,
    "buffer_hit_count": null,
    "buffer_read_count": null,
    "explain_plan": {}
  },
  {
    "sql_key": "com.test.mapper.UserMapper.testChooseWhen",
    "execution_time_ms": 0,
    "rows_scanned": 0,
    "execution_plan": {
      "node_type": "UNKNOWN",
      "index_used": null,
      "cost": null
    },
    "result_hash": "ad02a8997f87",
    "rows_returned": 0,
    "database_platform": "unknown",
    "sample_params": {},
    "actual_execution_time_ms": null,
    "buffer_hit_count": null,
    "buffer_read_count": null,
    "explain_plan": {}
  },
  {
    "sql_key": "com.test.mapper.OrderMapper.findOrdersWithCommon",
    "execution_time_ms": 0,
    "rows_scanned": 0,
    "execution_plan": {
      "node_type": "UNKNOWN",
      "index_used": null,
      "cost": null
    },
    "result_hash": "91bc723b7c47",
    "rows_returned": 0,
    "database_platform": "unknown",
    "sample_params": {},
    "actual_execution_time_ms": null,
    "buffer_hit_count": null,
    "buffer_read_count": null,
    "explain_plan": {}
  },
  {
    "sql_key": "com.test.mapper.UserMapper.testFourIf",
    "execution_time_ms": 0,
    "rows_scanned": 0,
    "execution_plan": {
      "node_type": "UNKNOWN",
      "index_used": null,
      "cost": null
    },
    "result_hash": "df8b3975f1f0",
    "rows_returned": 0,
    "database_platform": "unknown",
    "sample_params": {},
    "actual_execution_time_ms": null,
    "buffer_hit_count": null,
    "buffer_read_count": null,
    "explain_plan": {}
  },
  {
    "sql_key": "com.test.mapper.UserMapper.testThreeIf",
    "execution_time_ms": 0,
    "rows_scanned": 0,
    "execution_plan": {
      "node_type": "UNKNOWN",
      "index_used": null,
      "cost": null
    },
    "result_hash": "1a0db1e27f9a",
    "rows_returned": 0,
    "database_platform": "unknown",
    "sample_params": {},
    "actual_execution_time_ms": null,
    "buffer_hit_count": null,
    "buffer_read_count": null,
    "explain_plan": {}
  },
  {
    "sql_key": "com.test.mapper.OrderMapper.findOrdersByMode",
    "execution_time_ms": 0,
    "rows_scanned": 0,
    "execution_plan": {
      "node_type": "UNKNOWN",
      "index_used": null,
      "cost": null
    },
    "result_hash": "9a76591727b4",
    "rows_returned": 0,
    "database_platform": "unknown",
    "sample_params": {},
    "actual_execution_time_ms": null,
    "buffer_hit_count": null,
    "buffer_read_count": null,
    "explain_plan": {}
  },
  {
    "sql_key": "com.test.mapper.UserMapper.testTwoIf",
    "execution_time_ms": 0,
    "rows_scanned": 0,
    "execution_plan": {
      "node_type": "UNKNOWN",
      "index_used": null,
      "cost": null
    },
    "result_hash": "b7b0cf701390",
    "rows_returned": 0,
    "database_platform": "unknown",
    "sample_params": {},
    "actual_execution_time_ms": null,
    "buffer_hit_count": null,
    "buffer_read_count": null,
    "explain_plan": {}
  },
  {
    "sql_key": "com.test.mapper.UserMapper.testSingleIf",
    "execution_time_ms": 0,
    "rows_scanned": 0,
    "execution_plan": {
      "node_type": "UNKNOWN",
      "index_used": null,
      "cost": null
    },
    "result_hash": "eb37272f1638",
    "rows_returned": 0,
    "database_platform": "unknown",
    "sample_params": {},
    "actual_execution_time_ms": null,
    "buffer_hit_count": null,
    "buffer_read_count": null,
    "explain_plan": {}
  },
  {
    "sql_key": "com.test.mapper.UserMapper.testChooseOtherwise",
    "execution_time_ms": 0,
    "rows_scanned": 0,
    "execution_plan": {
      "node_type": "UNKNOWN",
      "index_used": null,
      "cost": null
    },
    "result_hash": "c5b63f52b7a9",
    "rows_returned": 0,
    "database_platform": "unknown",
    "sample_params": {},
    "actual_execution_time_ms": null,
    "buffer_hit_count": null,
    "buffer_read_count": null,
    "explain_plan": {}
  },
  {
    "sql_key": "com.test.mapper.OrderMapper.findOrdersConditional",
    "execution_time_ms": 0,
    "rows_scanned": 0,
    "execution_plan": {
      "node_type": "UNKNOWN",
      "index_used": null,
      "cost": null
    },
    "result_hash": "bd0965edcfd1",
    "rows_returned": 0,
    "database_platform": "unknown",
    "sample_params": {},
    "actual_execution_time_ms": null,
    "buffer_hit_count": null,
    "buffer_read_count": null,
    "explain_plan": {}
  },
  {
    "sql_key": "com.test.mapper.UserMapper.testWhereIf",
    "execution_time_ms": 0,
    "rows_scanned": 0,
    "execution_plan": {
      "node_type": "UNKNOWN",
      "index_used": null,
      "cost": null
    },
    "result_hash": "335e43cb2b13",
    "rows_returned": 0,
    "database_platform": "unknown",
    "sample_params": {},
    "actual_execution_time_ms": null,
    "buffer_hit_count": null,
    "buffer_read_count": null,
    "explain_plan": {}
  },
  {
    "sql_key": "com.test.mapper.UserMapper.testSetIf",
    "execution_time_ms": 0,
    "rows_scanned": 0,
    "execution_plan": {
      "node_type": "UNKNOWN",
      "index_used": null,
      "cost": null
    },
    "result_hash": "fb00b23869e1",
    "rows_returned": 0,
    "database_platform": "unknown",
    "sample_params": {},
    "actual_execution_time_ms": null,
    "buffer_hit_count": null,
    "buffer_read_count": null,
    "explain_plan": {}
  },
  {
    "sql_key": "com.test.mapper.UserMapper.testForeachIn",
    "execution_time_ms": 0,
    "rows_scanned": 0,
    "execution_plan": {
      "node_type": "UNKNOWN",
      "index_used": null,
      "cost": null
    },
    "result_hash": "e5a01efed4b8",
    "rows_returned": 0,
    "database_platform": "unknown",
    "sample_params": {},
    "actual_execution_time_ms": null,
    "buffer_hit_count": null,
    "buffer_read_count": null,
    "explain_plan": {}
  },
  {
    "sql_key": "com.test.mapper.UserMapper.testTrim",
    "execution_time_ms": 0,
    "rows_scanned": 0,
    "execution_plan": {
      "node_type": "UNKNOWN",
      "index_used": null,
      "cost": null
    },
    "result_hash": "a6fd76242921",
    "rows_returned": 0,
    "database_platform": "unknown",
    "sample_params": {},
    "actual_execution_time_ms": null,
    "buffer_hit_count": null,
    "buffer_read_count": null,
    "explain_plan": {}
  },
  {
    "sql_key": "com.test.mapper.UserMapper.testIfChoose",
    "execution_time_ms": 0,
    "rows_scanned": 0,
    "execution_plan": {
      "node_type": "UNKNOWN",
      "index_used": null,
      "cost": null
    },
    "result_hash": "d3661d2a952d",
    "rows_returned": 0,
    "database_platform": "unknown",
    "sample_params": {},
    "actual_execution_time_ms": null,
    "buffer_hit_count": null,
    "buffer_read_count": null,
    "explain_plan": {}
  },
  {
    "sql_key": "com.test.mapper.UserMapper.testWhereMultipleIf",
    "execution_time_ms": 0,
    "rows_scanned": 0,
    "execution_plan": {
      "node_type": "UNKNOWN",
      "index_used": null,
      "cost": null
    },
    "result_hash": "de0ab592f6a0",
    "rows_returned": 0,
    "database_platform": "unknown",
    "sample_params": {},
    "actual_execution_time_ms": null,
    "buffer_hit_count": null,
    "buffer_read_count": null,
    "explain_plan": {}
  },
  {
    "sql_key": "com.test.mapper.UserMapper.testChooseMultipleIf",
    "execution_time_ms": 0,
    "rows_scanned": 0,
    "execution_plan": {
      "node_type": "UNKNOWN",
      "index_used": null,
      "cost": null
    },
    "result_hash": "b283dd919b3b",
    "rows_returned": 0,
    "database_platform": "unknown",
    "sample_params": {},
    "actual_execution_time_ms": null,
    "buffer_hit_count": null,
    "buffer_read_count": null,
    "explain_plan": {}
  },
  {
    "sql_key": "com.test.mapper.UserMapper.testIfForeach",
    "execution_time_ms": 0,
    "rows_scanned": 0,
    "execution_plan": {
      "node_type": "UNKNOWN",
      "index_used": null,
      "cost": null
    },
    "result_hash": "2ddd17a28392",
    "rows_returned": 0,
    "database_platform": "unknown",
    "sample_params": {},
    "actual_execution_time_ms": null,
    "buffer_hit_count": null,
    "buffer_read_count": null,
    "explain_plan": {}
  },
  {
    "sql_key": "com.test.mapper.UserMapper.testWhereChooseWhen",
    "execution_time_ms": 0,
    "rows_scanned": 0,
    "execution_plan": {
      "node_type": "UNKNOWN",
      "index_used": null,
      "cost": null
    },
    "result_hash": "c6200e8a9428",
    "rows_returned": 0,
    "database_platform": "unknown",
    "sample_params": {},
    "actual_execution_time_ms": null,
    "buffer_hit_count": null,
    "buffer_read_count": null,
    "explain_plan": {}
  },
  {
    "sql_key": "com.test.mapper.UserMapper.testChooseWithMultipleIf",
    "execution_time_ms": 0,
    "rows_scanned": 0,
    "execution_plan": {
      "node_type": "UNKNOWN",
      "index_used": null,
      "cost": null
    },
    "result_hash": "7b92fafcf392",
    "rows_returned": 0,
    "database_platform": "unknown",
    "sample_params": {},
    "actual_execution_time_ms": null,
    "buffer_hit_count": null,
    "buffer_read_count": null,
    "explain_plan": {}
  },
  {
    "sql_key": "com.test.mapper.UserMapper.testFiveIf",
    "execution_time_ms": 0,
    "rows_scanned": 0,
    "execution_plan": {
      "node_type": "UNKNOWN",
      "index_used": null,
      "cost": null
    },
    "result_hash": "84ed786d1e5b",
    "rows_returned": 0,
    "database_platform": "unknown",
    "sample_params": {},
    "actual_execution_time_ms": null,
    "buffer_hit_count": null,
    "buffer_read_count": null,
    "explain_plan": {}
  },
  {
    "sql_key": "com.test.mapper.UserMapper.testChooseNestedChoose",
    "execution_time_ms": 0,
    "rows_scanned": 0,
    "execution_plan": {